{"protocolVersion":1,"type":"CAPABILITIES","sessionId":"6f1d2b0e-7d5a-4c1e-9f3a-2b8c4d5e6f70","sequence":3,"timestampNs":99887766,"payload":{"display":{"width":480,"height":640,"densityDpi":240,"refreshHz":60.0},"codecs":[{"name":"h264","profiles":["baseline","main","high"],"hardware":true,"lowLatency":false}],"maxDecode":{"width":1280,"height":720,"fps":30},"input":{"touchBar":true,"imu":true,"keys":true},"receiverModel":"EXAMPLE ONLY - populate from PlatformCapabilities.probe on the real device","receiverOs":"Android 12 / API 32","headViewportSupported":true}}
